<?xml version="1.0" encoding="iso-8859-1" standalone="no"?>
<!DOCTYPE Manga SYSTEM "./index.dtd">
<Index>
	<Donation>
		<Current>57</Current>
		<Goal>450</Goal>
		<Server>90</Server>
		<Media1>150</Media1>
		<Media2>150</Media2>
		<Month>7</Month>
		<Year>2006</Year>
		<Donate>
			<Donator>Anonamous</Donator>
			<Amount>57</Amount>
		</Donate>
	</Donation>
	<Releases>
		<Anime>
			<aRAW>89</aRAW>
			<aSUB>89</aSUB>
		</Anime>
		<Manga>
			<mRAW>236</mRAW>
			<mSUB>235</mSUB>
		</Manga>
	</Releases>
</Index>